{
  "schema_version": "1",
  "scenario": "atomic_feature",
  "expectations": {
    "initial_update": "optional",
    "progress_updates": {
      "minimum": 0,
      "maximum": 1,
      "require_new_information": true
    },
    "questions": {
      "minimum": 0,
      "maximum": 0
    },
    "approval_requests": {
      "minimum": 0,
      "maximum": 0
    },
    "final_answer_words": {
      "minimum": 1,
      "maximum": 100
    },
    "prompt_restatement": false
  },
  "rubric": [
    "directness",
    "proportionality",
    "progress_usefulness",
    "autonomy",
    "candor",
    "warmth",
    "restraint",
    "completion_clarity"
  ]
}
